,title,authors,comment,subjects,abstract,nb_of_aut
28,Constraining the Milky Way's Pulsar Population with the Cosmic-Ray Positron Fraction,"['Olivia Meredith Bitter', 'Dan Hooper']","15 pages, 6 figures",High Energy Astrophysical Phenomena (astro-ph.HE); Cosmology and Nongalactic Astrophysics (astro-ph.CO); Astrophysics of Galaxies (astro-ph.GA); High Energy Physics - Phenomenology (hep-ph),"Observations of the TeV halos associated with nearby pulsars indicate thatthese objects inject significant fluxes of very high-energy electron-positronspairs into the interstellar medium (ISM), thereby likely providing the dominantcontribution to the cosmic-ray positron flux. In this paper, we use thecosmic-ray positron fraction as measured by the AMS-02 Collaboration toconstrain the characteristics of the local pulsar population. For reasonablemodel parameters, we find that we can obtain good agreement with the measuredpositron fraction up to energies of $E_e \sim 300 \, {\rm GeV}$. At higherenergies, the positron fraction is dominated by a small number of pulsars,making it difficult to reliably predict the shape of the expected positronfraction. The low-energy positron spectrum supports the conclusion that pulsarstypically transfer approximately $\eta \sim 5-20\%$ of their total spindownpower into the production of very high-energy electron-positron pairs,producing a spectrum of such particles with a hard spectral index, $\alpha \sim1.5-1.7$. Such pulsars typically spindown on a timescale on the order of $\tau\sim 10^4 \, {\rm years}$. Our best fits were obtained for models in which theradio and gamma-ray beams from pulsars are detectable to 28% and 62% ofsurrounding observers, respectively.",2
29,Search for low-mass dark matter WIMPs with 12 ton-day exposure of DarkSide-50,"['DarkSide-50 Collaboration', 'P. Agnes', 'I. F. M. Albuquerque', 'T. Alexander', 'A. K. Alton', 'M. Ave', 'H. O. Back', 'G. Batignani', 'K. Biery', 'V. Bocci', 'W. M. Bonivento', 'B. Bottino', 'S. Bussino', 'M. Cadeddu', 'M. Cadoni', 'F. Calaprice', 'A. Caminata', 'N. Canci', 'M. Caravati', 'M. Cariello', 'M. Carlini', 'M. Carpinelli', 'V. Cataudella', 'P. Cavalcante', 'S. Cavuoti', 'S. Chashin', 'A. Chepurnov', 'C. Cicalò', 'G. Covone', ""D. D'Angelo"", 'S. Davini', 'A. De Candia', 'S. De Cecco', 'G. De Filippis', 'G. De Rosa', 'A. V. Derbin', 'A. Devoto', ""M. D'Incecco"", 'C. Dionisi', 'F. Dordei', 'M. Downing', ""D. D'Urso"", 'G. Fiorillo', 'D. Franco', 'F. Gabriele', 'C. Galbiati', 'C. Ghiano', 'C. Giganti', 'G. K. Giovanetti', 'A. M. Goretti', 'G. Grilli di Cortona', 'A. Grobov', 'M. Gromov', 'M. Guan', 'M. Gulino', 'B. R. Hackett', 'K. Herner', 'T. Hessel', 'B. Hosseini', 'F. Hubaut', 'E. V. Hungerford', 'An. Ianni', 'V. Ippolito', 'K. Keeter', 'C. L. Kendziora', 'M. Kimura', 'I. Kochanek', 'D. Korablev', 'G. Korga', 'A. Kubankin', 'M. Kuss', 'M. La Commara', 'M. Lai', 'X. Li', 'M. Lissia', 'G. Longo', 'O. Lychagina', 'I. N. Machulin', 'L. P. Mapelli', 'S. M. Mari', 'J. Maricic', 'A. Messina', 'R. Milincic', 'J. Monroe', 'M. Morrocchi', 'X. Mougeot', 'V. N. Muratova', 'P. Musico', 'A. O. Nozdrina', 'A. Oleinik', 'F. Ortica', 'L. Pagani', 'M. Pallavicini', 'L. Pandola', 'E. Pantic', 'E. Paoloni', 'K. Pelczar', 'N. Pelliccia', 'S. Piacentini', 'S. Piacentini', 'E. Picciau', 'A. Pocar', 'D. M. Poehlmann', 'S. Pordes', 'S. S. Poudel', 'P. Pralavorio', 'D. D. Price', 'F. Ragusa', 'M. Razeti', 'A. Razeto', 'A. L. Renshaw', 'M. Rescigno', 'J. Rode', 'A. Romani', 'D. Sablone', 'O. Samoylov', 'W. Sands', 'S. Sanfilippo', 'E. Sanford', 'C. Savarese', 'B. Schlitzer', 'D. A. Semenov', 'A. Shchagin', 'A. Sheshukov', 'M. D. Skorokhvatov', 'O. Smirnov', 'A. Sotnikov', 'S. Stracka', 'Y. Suvorov', 'R. Tartaglia', 'G. Testera', 'A. Tonazzo', 'E. V. Unzhakov', 'A. Vishneva', 'R. B. Vogelaar', 'M. Wada', 'H. Wang', 'Y. Wang', 'S. Westerdale', 'M. M. Wojcik', 'X. Xiao', 'C. Yang', 'G. Zuzel', '\n    et al. (43 additional authors not shown)']","11 pages, 12 figures",High Energy Physics - Experiment (hep-ex); Cosmology and Nongalactic Astrophysics (astro-ph.CO),"We report on the search for dark matter WIMPs in the mass range below 10GeV/c$^2$, from the analysis of the entire dataset acquired with alow-radioactivity argon target by the DarkSide-50 experiment at LNGS. The newanalysis benefits from more accurate calibration of the detector response,improved background model, and better determination of systematicuncertainties, allowing us to accurately model the background rate and spectradown to 0.06 keV$_{er}$. A 90% C.L. exclusion limit for the spin-independentcross section of 3 GeV/c$^2$ mass WIMP on nucleons is set at6$\times$10$^{-43}$ cm$^2$, about a factor 10 better than the previousDarkSide-50 limit. This analysis extends the exclusion region forspin-independent dark matter interactions below the current experimentalconstraints in the $[1.2, 3.6]$ GeV/c$^2$ WIMP mass range.",144
30,Search for dark matter-nucleon interactions via Migdal effect with DarkSide-50,"['DarkSide-50 Collaboration', 'P. Agnes', 'I. F. M. Albuquerque', 'T. Alexander', 'A. K. Alton', 'M. Ave', 'H. O. Back', 'G. Batignani', 'K. Biery', 'V. Bocci', 'W. M. Bonivento', 'B. Bottino', 'S. Bussino', 'M. Cadeddu', 'M. Cadoni', 'F. Calaprice', 'A. Caminata', 'M.D. Campos', 'N. Canci', 'M. Caravati', 'M. Cariello', 'M. Carlini', 'M. Carpinelli', 'V. Cataudella', 'P. Cavalcante', 'S. Cavuoti', 'S. Chashin', 'A. Chepurnov', 'C. Cicalò', 'G. Covone', ""D. D'Angelo"", 'S. Davini', 'A. De Candia', 'S. De Cecco', 'G. De Filippis', 'G. De Rosa', 'A. V. Derbin', 'A. Devoto', ""M. D'Incecco"", 'C. Dionisi', 'F. Dordei', 'M. Downing', ""D. D'Urso"", 'M. Fairbairn', 'G. Fiorillo', 'D. Franco', 'F. Gabriele', 'C. Galbiati', 'C. Ghiano', 'C. Giganti', 'G. K. Giovanetti', 'A. M. Goretti', 'G. Grilli di Cortona', 'A. Grobov', 'M. Gromov', 'M. Guan', 'M. Gulino', 'B. R. Hackett', 'K. Herner', 'T. Hessel', 'B. Hosseini', 'F. Hubaut', 'E. V. Hungerford', 'An. Ianni', 'V. Ippolito', 'K. Keeter', 'C. L. Kendziora', 'M. Kimura', 'I. Kochanek', 'D. Korablev', 'G. Korga', 'A. Kubankin', 'M. Kuss', 'M. La Commara', 'M. Lai', 'X. Li', 'M. Lissia', 'G. Longo', 'O. Lychagina', 'I. N. Machulin', 'L. P. Mapelli', 'S. M. Mari', 'J. Maricic', 'A. Messina', 'R. Milincic', 'J. Monroe', 'M. Morrocchi', 'X. Mougeot', 'V. N. Muratova', 'P. Musico', 'A. O. Nozdrina', 'A. Oleinik', 'F. Ortica', 'L. Pagani', 'M. Pallavicini', 'L. Pandola', 'E. Pantic', 'E. Paoloni', 'K. Pelczar', 'N. Pelliccia', 'S. Piacentini', 'S. Piacentini', 'E. Picciau', 'A. Pocar', 'D. M. Poehlmann', 'S. Pordes', 'S. S. Poudel', 'P. Pralavorio', 'D. D. Price', 'F. Ragusa', 'M. Razeti', 'A. Razeto', 'A. L. Renshaw', 'M. Rescigno', 'J. Rode', 'A. Romani', 'D. Sablone', 'O. Samoylov', 'W. Sands', 'S. Sanfilippo', 'E. Sanford', 'C. Savarese', 'B. Schlitzer', 'D. A. Semenov', 'A. Shchagin', 'A. Sheshukov', 'M. D. Skorokhvatov', 'O. Smirnov', 'A. Sotnikov', 'S. Stracka', 'Y. Suvorov', 'R. Tartaglia', 'G. Testera', 'A. Tonazzo', 'E. V. Unzhakov', 'A. Vishneva', 'R. B. Vogelaar', 'M. Wada', 'H. Wang', 'Y. Wang', 'S. Westerdale', 'M. M. Wojcik', 'X. Xiao', 'C. Yang', 'G. Zuzel', '\n    et al. (45 additional authors not shown)']","7 pages, 3 figures",High Energy Physics - Experiment (hep-ex); Cosmology and Nongalactic Astrophysics (astro-ph.CO),"Dark matter elastic scattering off nuclei can result in the excitation andionization of the recoiling atom through the so-called Migdal effect. Theenergy deposition from the ionization electron adds to the energy deposited bythe recoiling nuclear system and allows for the detection of interactions ofsub-GeV/c$^2$ mass dark matter. We present new constraints for sub-GeV/c$^2$dark matter using the dual-phase liquid argon time projection chamber of theDarkSide-50 experiment with an exposure of (12306 $\pm$ 184) kg d. The analysisis based on the ionization signal alone and significantly enhances thesensitivity of DarkSide-50, enabling sensitivity to dark matter with massesdown to 40 MeV/c$^2$. Furthermore, it sets the most stringent upper limit onthe spin independent dark matter nucleon cross section for masses below $3.6$GeV/c$^2$.",146
31,Search for dark matter particle interactions with electron final states with DarkSide-50,"['DarkSide-50 Collaboration', 'P. Agnes', 'I. F. M. Albuquerque', 'T. Alexander', 'A. K. Alton', 'M. Ave', 'H. O. Back', 'G. Batignani', 'K. Biery', 'V. Bocci', 'W. M. Bonivento', 'B. Bottino', 'S. Bussino', 'M. Cadeddu', 'M. Cadoni', 'F. Calaprice', 'A. Caminata', 'M. D. Campos', 'N. Canci', 'M. Caravati', 'M. Cariello', 'M. Carlini', 'M. Carpinelli', 'V. Cataudella', 'P. Cavalcante', 'S. Cavuoti', 'S. Chashin', 'A. Chepurnov', 'C. Cicalò', 'G. Covone', ""D. D'Angelo"", 'S. Davini', 'A. De Candia', 'S. De Cecco', 'G. De Filippis', 'G. De Rosa', 'A. V. Derbin', 'A. Devoto', ""M. D'Incecco"", 'C. Dionisi', 'F. Dordei', 'M. Downing', ""D. D'Urso"", 'G. Fiorillo', 'D. Franco', 'F. Gabriele', 'C. Galbiati', 'C. Ghiano', 'C. Giganti', 'G. K. Giovanetti', 'A. M. Goretti', 'G. Grilli di Cortona', 'A. Grobov', 'M. Gromov', 'M. Guan', 'M. Gulino', 'B. R. Hackett', 'K. Herner', 'T. Hessel', 'B. Hosseini', 'F. Hubaut', 'E. V. Hungerford', 'An. Ianni', 'V. Ippolito', 'K. Keeter', 'C. L. Kendziora', 'M. Kimura', 'I. Kochanek', 'D. Korablev', 'G. Korga', 'A. Kubankin', 'M. Kuss', 'M. La Commara', 'M. Lai', 'X. Li', 'M. Lissia', 'G. Longo', 'O. Lychagina', 'I. N. Machulin', 'L. P. Mapelli', 'S. M. Mari', 'J. Maricic', 'A. Messina', 'R. Milincic', 'J. Monroe', 'M. Morrocchi', 'X. Mougeot', 'V. N. Muratova', 'P. Musico', 'A. O. Nozdrina', 'A. Oleinik', 'F. Ortica', 'L. Pagani', 'M. Pallavicini', 'L. Pandola', 'E. Pantic', 'E. Paoloni', 'K. Pelczar', 'N. Pelliccia', 'S. Piacentini', 'S. Piacentini', 'E. Picciau', 'A. Pocar', 'D. M. Poehlmann', 'S. Pordes', 'S. S. Poudel', 'P. Pralavorio', 'D. D. Price', 'F. Ragusa', 'M. Razeti', 'A. Razeto', 'A. L. Renshaw', 'M. Rescigno', 'J. Rode', 'A. Romani', 'D. Sablone', 'O. Samoylov', 'W. Sands', 'S. Sanfilippo', 'E. Sanford', 'C. Savarese', 'B. Schlitzer', 'D. A. Semenov', 'A. Shchagin', 'A. Sheshukov', 'M. D. Skorokhvatov', 'O. Smirnov', 'A. Sotnikov', 'S. Stracka', 'Y. Suvorov', 'R. Tartaglia', 'G. Testera', 'A. Tonazzo', 'E. V. Unzhakov', 'A. Vishneva', 'R. B. Vogelaar', 'M. Wada', 'H. Wang', 'Y. Wang', 'S. Westerdale', 'M. M. Wojcik', 'X. Xiao', 'C. Yang', 'G. Zuzel', '\n    et al. (44 additional authors not shown)']","6 pages, 2 figures",High Energy Physics - Experiment (hep-ex); Cosmology and Nongalactic Astrophysics (astro-ph.CO),"We present a search for dark matter particles with sub-GeV/$c^2$ masses whoseinteractions have final state electrons using the DarkSide-50 experiment's(12306 $\pm$ 184) kg d low-radioactivity liquid argon exposure. By analyzingthe ionization signals, we exclude new parameter space for the darkmatter-electron cross section $\bar{\sigma}_e$, the axioelectric couplingconstant $g_{Ae}$, and the dark photon kinetic mixing parameter $\kappa$. Wealso set the first dark matter direct-detection constraints on the mixing angle$\left|U_{e4}\right|^2$ for keV sterile neutrinos.",145
32,Suitability of Magnetic Microbolometers based on Paramagnetic Temperature Sensors for CMB Polarization Measurements,"['Juan Manuel Geria', 'Matias Rolf Hampel', 'Sebastian Kempf', 'Juan Jose Bonaparte', 'Luciano Pablo Ferreyro', 'Manuel Eliías Garcia Redondo', 'Daniel Alejandro Almela', 'Juan Manuel Salum', 'Nahuel Müller', 'Jesus David Bonilla-Neira', 'Alan Ezequiel Fuster', 'Manuel Platino', 'Alberto Etchegoyen']","20 pages, 11 figures. Published in SPIE's Journal of Astronomical Telescopes, Instruments and Systems (JATIS)",Instrumentation and Detectors (physics.ins-det); Cosmology and Nongalactic Astrophysics (astro-ph.CO),"High resolution maps of polarization anisotropies of the Cosmic MicrowaveBackground (CMB) are in high demand, since the discovery of primordial B-Modesin the polarization patterns would confirm the inflationary phase of theUniverse that would have taken place before the last scattering of the CMB atthe recombination epoch. Transition Edge Sensors (TES) and Microwave KineticInductance Detectors (MKID) are the predominant detector technologies ofcryogenic detector array based CMB instruments that search for primordialB-Modes. In this paper we propose another type of cryogenic detector to be usedfor CMB survey: A magnetic microbolometer (MMB) that is based on a paramagnetictemperature sensor. It is an adaption of state-of-the-art metallic magneticcalorimeters (MMCs) that are meanwhile a key technology for high resolution$\alpha$, $\beta$, $\gamma$ and X-ray spectroscopy as well as the study ofneutrino mass. The effort to adapt MMCs for CMB surveys is triggered by theirlack of Johnson noise associated with the detector readout, the possibility ofstraightforward calibration and higher dynamic range given it possesses a broadand smooth responsivity dependence with temperature and the absence of Jouledissipation which simplifies the thermal design. A brief proof of concept casestudy is analyzed, taking into account typical constraints in CMB measurementsand reliable microfabrication processes. The results show that MMBs provide apromising technology for CMB polarization survey as their sensitivity can betuned for background limited detection of the sky while simultaneouslymaintaining a low time response to avoid distortion of the point-sourceresponse of the telescope. As the sensor technology and its fabricationtechniques are compatible with TES based bolometric detector arrays, a changeof detector technology would even come with very low cost.",13
33,Role of magnetic fields in the formation of direct collapse black holes,"['Muhammad A. Latif', 'Dominik R. G. Schleicher', 'Sadegh Khochfar']","To be published ApJ, comments are still welcome",High Energy Astrophysical Phenomena (astro-ph.HE); Cosmology and Nongalactic Astrophysics (astro-ph.CO),"Direct collapse black holes (DCBHs) are the leading candidates for the originof the first supermassive black holes. However, the role of magnetic fieldsduring their formation is still unclear as none of the previous studies hasbeen evolved long enough to assess their impact during the accretion phase.Here, we report the results from a suite of 3D cosmologicalmagneto-hydrodynamic (MHD) simulations which are evolved for 1.6 Myrscomparable to the expected lifetime of supermassive stars (SMSs). Our findingssuggest that magnetic fields are rapidly amplified by strong accretion shocksirrespective of the initial magnetic field strength and reach the saturationstate. They stabilize the accretion disks and significantly reducefragmentation by enhancing the Jeans mass in comparison with purehydrodynamical runs. Although the initial clump masses are larger in MHD runs,the rapid coalescence of clumps in non-MHD cases due to the higher degree offragmentation results in similar masses. Overall, the central clumps havemasses of $\rm 10^5~M_{\odot}$ and the mean mass accretion rates of $\rm \sim0.1 ~M_{\odot}/yr$ are similar in both MHD and non-MHD cases. The multiplicityof SMSs is significantly reduced in MHD simulations. Such strongly amplifiedmagnetic fields are expected to launch Jets and outflows which may be detectedwith upcoming radio telescopes.",3
34,Updated Constraints on Primordial Black Hole Evaporation,"['Mrunal Korwar', 'Stefano Profumo']","13 pages, 2 figures, references added",High Energy Physics - Phenomenology (hep-ph); Cosmology and Nongalactic Astrophysics (astro-ph.CO),"The Hawking evaporation process, leading to the production of detectableparticle species, constrains the abundance of light black holes, presumably ofprimordial origin. Here, we reconsider and correct constraints from softgamma-ray observations, including of the gamma-ray line, at 511 keV, producedby electron-positron pair-annihilation, where positrons originate from blackhole evaporation. First, we point out that the INTEGRAL detection of the LargeMagellanic Cloud provides one of the strongest bounds attainable with presentobservations; and that future MeV gamma-ray telescopes, such as GECCO, willgreatly enhance such constraints. Second, we discuss issues with previouslimits from the isotropic flux at 511 keV and we provide updated, robustconstraints from recent measurements of the diffuse Galactic soft gamma-rayemission and from the isotropic soft gamma-ray background.",2
