,title,authors,comment,subjects,abstract,nb_of_aut
13,An Effective Model for the Cosmic-Dawn 21-cm Signal,['Julian B. Muñoz'],"20+2 pages, 21+3 figures. Comments welcome. Code available at this https URL",Cosmology and Nongalactic Astrophysics (astro-ph.CO); Astrophysics of Galaxies (astro-ph.GA); High Energy Physics - Phenomenology (hep-ph),"The 21-cm signal holds the key to understanding the first structure formationduring cosmic dawn. Theoretical progress over the last decade has focused onsimulations of this signal, given the nonlinear and nonlocal relation betweeninitial conditions and observables (21-cm or reionization maps). Here, instead,we propose an effective and fully analytic model for the 21-cm signal duringcosmic dawn. We take advantage of the exponential-like behavior of the localstar-formation rate density (SFRD) against densities at early times toanalytically find its correlation functions including nonlinearities. The SFRDacts as the building block to obtain the statistics of radiative fields (X-rayand Lyman-$\alpha$ fluxes), and therefore the 21-cm signal. We implement thismodel as the public Python package Zeus21. This code can fully predict the21-cm global signal and power spectrum in $\sim 1$ s, with negligible memoryrequirements. When comparing against state-of-the-art semi-numericalsimulations from 21CMFAST we find agreement to 10\% precision in both the 21-cmglobal signal and power spectra, after accounting for a (previously missed)underestimation of adiabatic fluctuations in 21CMFAST. Zeus21 is modular,allowing the user to vary the astrophysical model for the first galaxies, andinterfaces with the cosmological code CLASS, which enables searches for beyondstandard-model cosmology in 21-cm data. This represents a step towards bringing21-cm to the era of precision cosmology.",1
14,Can LIGO Detect Asymmetric Dark Matter?,"['Sulagna Bhattacharya', 'Basudeb Dasgupta', 'Ranjan Laha', 'Anupam Ray']","14 pages, 6 figures. Comments welcome",High Energy Physics - Phenomenology (hep-ph); Cosmology and Nongalactic Astrophysics (astro-ph.CO); High Energy Astrophysical Phenomena (astro-ph.HE),"Dark matter from the galactic halo can accumulate in neutron stars andtransmute them into sub-2.5 $M_\odot$ black holes if the dark matter particlesare heavy, stable, and have interactions with nucleons. We show thatnon-detection of gravitational waves from mergers of such low-mass black holescan constrain the interactions of asymmetric dark matter particles withnucleons. We find benchmark constraints with LIGO O3 data, viz., $\sigma_{\chin} \geq {\cal O}(10^{-47})$ cm$^2$ for bosonic DM with $m_\chi\sim$ PeV (or$m_\chi\sim$ GeV, if they can Bose-condense) and $\geq {\cal O}(10^{-46})$cm$^2$ for fermionic DM with $m_\chi \sim 10^3$ PeV. These bounds depend on thepriors on DM parameters and on the currently uncertain binary neutron starmerger rate density. However, if null-detection continues with increasedexposure over the next decade, LIGO will set remarkable constraints. We findthe forecasted sensitivity to heavy asymmetric dark matter to be world-leading,viz., dipping many orders of magnitude below the neutrino floor and completelytesting the dark matter solution to missing pulsars in the Galactic center, anddemonstrate a windfall science-case for gravitational wave detectors.",4
15,Analyzing the cosmic architecture in the vicinity of Grand-design and Flocculent spiral galaxies with Local Geometric Index,"['Suman Sarkar', 'Ganesh Narayanan', 'Arunima Banerjee']","19 pages, 7 figures and 3 tables",Astrophysics of Galaxies (astro-ph.GA); Cosmology and Nongalactic Astrophysics (astro-ph.CO); Instrumentation and Methods for Astrophysics (astro-ph.IM),"We explore the environment of 351 Grand-design and 541 Flocculent spiralgalaxies recently identified employing machine learning techniques from the$17^{th}$ data release of Sloan Digital Sky Survey. We introduce a novelestimator called the Local Geometric Index to quantify the morphology of thelocal environment of these 892 galaxies. Based on the Local Geometric Index ofthe galaxies, we identify their local environments to be void, sheet, filamentor cluster. We find that the Grand-designs are mostly located in denseenvironments like clusters and filaments, whereas the Flocculents lie in sparseenvironments in voids and sheets. A $p$-value $<$ $10 ^{-10}$ from aKolmogorov-Smirnov test indicates that our results are statisticallysignificant at $99.9\%$ confidence level. Further, we note that denseenvironments with large tidal flows are dominated by the Grand-designs.Metal-poor environments, such as sheets and voids, with a high abundance of gasclouds, on the other hand, are mostly populated by the Flocculents.",3
16,NOEMA spatially resolved view of the multi-phase outflow in IRAS17020+4544: a shocked wind in action?,"['Anna Lia Longinotti', 'Quentin Salomé', 'Chiara Feruglio', 'Yair Krongold', 'Santiago García-Burillo', 'Marcello Giroletti', 'Francesca Panessa', 'Carlo Stanghellini', 'Olga Vega', 'Victor Manuel Patiño-Álvarez', 'Vahram Chavushyan', 'Mauricio Elías-Chavez', 'Aitor Robleto-Orús']","Accepted for publication on MNRAS, 17 pages, 7 figures",Astrophysics of Galaxies (astro-ph.GA); Cosmology and Nongalactic Astrophysics (astro-ph.CO),"The Narrow Line Seyfert 1 Galaxy IRAS17020+4544 is one of the few AGN where agalaxy-scale energy-conserving outflow was revealed. This paper reports onNOEMA observations addressed to constrain the spatial scale of the CO emissionin outflow. The molecular outflowing gas is resolved in five components tracingapproaching and receding gas, all located at a distance of 2-3~kpc on the Westand East side of the active nucleus. This high velocity gas (up to v_out=~1900km/s) is not coincident with the rotation pattern of the CO gas in the hostgalaxy disk. The estimated mass outflow rate shows that with a global massoutput of $\dot{M}_{H_2}$=~139$\pm$20$~M_\odot$~yr$^{-1}$, this powerfulgalaxy-scale outflow is consistent with the wind conserving its energy, andwith a momentum rate boost of a factor of ~30 compared to the momentum rate ofthe nuclear X-ray wind. Preliminary results from ancillary X-ray (Chandra) andradio images (e-MERLIN) are reported. While the nature of the radio source isnot conclusive, the Chandra image may tentatively trace extended emission, asexpected by an expanding bubble of hot X-ray gas. The outcome of the NOEMAanalysis and of past and ongoing publications dedicated to the description ofthe outflow multi-band phenomenology in IRAS17020+4544 concur to providecompelling reasons to postulate that an outflow shocking with the galaxyinterstellar medium is driving the multi-phase wind in this peculiar AGN.",13
17,Exploring binary black hole mergers and host galaxies with {\sc Shark} and COMPAS,"['Liana Rauf', 'Cullan Howlett', 'Tamara M. Davis', 'Claudia D. P. Lagos']","19 pages, 16 figures - Will be submitted to MNRAS",Astrophysics of Galaxies (astro-ph.GA); Cosmology and Nongalactic Astrophysics (astro-ph.CO),"In this work, we explore the connection between the gravitational wave (GW)merger rates of stellar-mass binary black holes (BBH) and galaxy properties. Wedo this by generating populations of stars using the binary synthesis codeCOMPAS and evolving them in galaxies from the semi-analytic galaxy formationmodel {\sc Shark}, to determine the number of mergers occurring in eachsimulation time-step. We find that large, metal-rich galaxies with high starformation rates are more likely to have gravitational wave (GW) events comparedto younger, more metal poor galaxies. Our simulation with the default inputparameters predicts a higher local merger rate density compared to the thirdgravitational wave transient catalogue (GWTC-3) prediction from LIGO, VIRGO andKAGRA. This is due to short coalescence times, low metallicities and an highformation rate of stars at low redshift in the galaxy simulation, whichproduces more BBHs that merge within the age of the Universe compared toobservations. We identify alternate remnant mass models that more accuratelyreproduce the observed volumetric rate and provide updated fits to the mergerrate distribution as a function of redshift. We then investigate the relativefraction of GW events in our simulation volume that are in observable hostgalaxies from different upcoming photometric and spectroscopic surveys,determining which of those are more ideal for tracing host galaxies with highmerger rates. The implications of this work can be utilised for numerousapplications, including for constraining stellar evolution models, betterinforming follow-up programs, and placing more informative priors on potentialhost galaxies when measuring cosmological parameters such as the Hubbleconstant.",4
18,Graviton-photon oscillation in a cosmic background for a general theory of gravity,"['José A. R. Cembranos', 'Miguel González Ortiz', 'Prado Martín-Moruno']","12 pages, 4 figures",General Relativity and Quantum Cosmology (gr-qc); Cosmology and Nongalactic Astrophysics (astro-ph.CO); High Energy Physics - Theory (hep-th),"Graviton-photon oscillation is the conversion of gravitational waves toelectromagnetic waves and vice versa in the presence of a backgroundelectromagnetic field. We investigate this phenomenon in a cosmologicalscenario considering a background cosmic magnetic field and assuming differentgravitational frameworks. We obtain the damping term that characterizes theattenuation of the conversion probability in cosmological backgrounds. This isa general feature that is present even for standard General Relativity.Furthermore, we show that the effects of decoherence, which are due to theinteraction with the cosmological expansion and with the additional degrees offreedom of alternative theories of gravity, can be relevant to the phenomenonof graviton-photon mixing.",3
19,Saturon Dark Matter,['Gia Dvali'],"18 pages, Latex",High Energy Physics - Phenomenology (hep-ph); Cosmology and Nongalactic Astrophysics (astro-ph.CO); General Relativity and Quantum Cosmology (gr-qc); High Energy Physics - Theory (hep-th),"Saturons are macroscopic objects with maximal microstate entropy. Due to thisproperty, they can be produced via quantum transitions from a homogeneousthermal bath, bypassing the standard exponential suppression characteristic ofordinary extended objects. In this sense, saturons carry an advantage withrespect to other macroscopic objects such as black holes and ordinary solitons.Due to unsuppressed thermal production, saturons can have interestingcosmological implications. In particular they can serve as viable dark mattercandidates with some unique features. Unlike ordinary particle dark matter, thesuperheavy saturons can freeze-in at very low temperatures. A nucleation of asaturon can be described in terms of a saturated instanton. This hasimplications for various phase transitions.",1
20,Modeling Cosmological Perturbations of Thermal Inflation,"['Jeong-Myeong Bae', 'Sungwook E. Hong', 'Heeseung Zoe']","18 pages, 5 figures, corrected references and citations",Cosmology and Nongalactic Astrophysics (astro-ph.CO),"We consider a simple system consisting of matter, radiation and vacuumcomponents to model the impact of thermal inflation on the evolution ofprimordial perturbations. The vacuum energy magnifies the modes entering thehorizon before its domination, making them potentially observable, and theresulting transfer function reflects the phase changes and energy contents. Todetermine the transfer function, we follow the curvature perturbation from welloutside the horizon during radiation domination to well outside the horizonduring vacuum domination and evaluate it on a constant radiation densityhypersurface, as is appropriate for the case of thermal inflation. The shape ofthe transfer function is determined by the ratio of vacuum energy to radiationat matter-radiation equality, which we denote by $\upsilon$, and has twocharacteristic scales, $k_{\rm a}$ and $k_{\rm b}$, corresponding to thehorizon sizes at matter radiation equality and the beginning of the inflation,respectively. If $\upsilon \ll 1$, the universe experiences radiation, matterand vacuum domination eras and the transfer function is flat for $k \ll k_{\rmb}$, oscillates with amplitude $1/5$ for $ k_{\rm b} \ll k \ll k_{\rm a}$ andoscillates with amplitude $1$ for $k \gg k_{\rm a}$. For $\upsilon \gg 1$, thematter domination era disappears, and the transfer function reduces to beingflat for $k \ll k_{\rm b}$ and oscillating with amplitude $1$ for $k \gg k_{\rmb}$.",3
21,Measuring the distortion of time with relativistic effects in large-scale structure,"['Daniel Sobral-Blanco', 'Camille Bonvin']","6 pages, 1 figure, 2 tables. V2 matches the published version",Cosmology and Nongalactic Astrophysics (astro-ph.CO); General Relativity and Quantum Cosmology (gr-qc),"To test the theory of gravity one needs to test, on one hand, how space andtime are distorted by matter and, on the other hand, how matter moves in adistorted space-time. Current observations provide tight constraints on themotion of matter, through the so-called redshift-space distortions, but theyonly provide a measurement of the sum of the spatial and temporal distortions,via gravitational lensing. In this Letter, we develop a method to measure thetime distortion on its own. We show that the coming generation of galaxysurveys, like the Square Kilometer Array, will allow us to measure thedistortion of time with an accuracy of 10-30%. Such a measurement will beessential to test deviations from the $\Lambda$CDM model in a fullymodel-independent way. In particular, it can be used to compare the spatial andtemporal distortions of space-time and to unambiguously distinguish betweenmodifications of gravity and dark fifth forces acting on dark matter.",2
22,A New Observational $H(z)$ Data from Full-Spectrum Fitting of Cosmic Chronometers in the LEGA-C Survey,"['Kang Jiao', 'Nicola Borghi', 'Michele Moresco', 'Tong-Jie Zhang']","21 pages, 1 table, 9 figures, accepted for publication in ApJS. A new OHD supplement to 32 released data (including 4 OHD by Zhang et al. 2014. RAA, 14, 1221) is available for cosmological model independent studies",Cosmology and Nongalactic Astrophysics (astro-ph.CO),"In this work, we perform a full-spectrum fitting of 350 massive and passivegalaxies selected as cosmic chronometers from the LEGA-C ESO public survey toderive their stellar ages, metallicities, and star-formation histories. Weextensively test our results by assessing their dependence on the possiblecontribution of dust, calibration of noise and signal, and the use ofphotometric data in addition to spectral information; we as well identifyindicators of the correct convergence of the results, including the shape ofthe posterior distributions, the analysis of specific spectral features, andthe correct reproduction of the observed spectrum. We derive a clearage-redshift trend compatible with the aging in a standard cosmological model,showing a clear downsizing pattern, with more massive galaxies being formed athigher redshift ($z_f\sim2.5$) with respect to lower massive ones ($z_f\sim2$).From these data, we measure the differential aging of this population of cosmicchronometers to derive a new measurement of the Hubble parameter, obtaining$H(z=0.8) = 113.1 \pm 15.2 (\mathrm{stat.}) ^{+24.2}_{-4.0} (\mathrm{syst.})\\mathrm{ km\ s^{-1}\ Mpc^{-1}}$. This analysis allows us for the first time tocompare the differential ages of cosmic chronometers measured on the samesample with two completely different methods, the full-spectrum fit (this work)and the analysis of Lick indices, known to correlate with the age andmetallicity of the stellar populations \citep{Borghi2022a}. Albeit anunderstood offset in the absolute ages, the differential ages have proven to beextremely compatible between the two methods, despite the very different data,assumptions, and models considered, demonstrating the robustness of the method.",4
23,TDCOSMO. XI. New lensing galaxy redshift and velocity dispersion measurements from Keck spectroscopy of eight lensed quasar systems,"['P. Mozumdar', 'C. D. Fassnacht', 'T. Treu', 'C. Spiniello', 'A. J. Shajib']","13 pages, 6 figures, 3 tables; accepted in A&A",Cosmology and Nongalactic Astrophysics (astro-ph.CO); Astrophysics of Galaxies (astro-ph.GA); Instrumentation and Methods for Astrophysics (astro-ph.IM),"We have measured the redshifts and single-aperture velocity dispersions ofeight lens galaxies using the data collected by the Echellette Spectrograph andImager (ESI) and Low Resolution Imaging Spectrometer (LRIS) at W.M. Keckobservatory on different observing nights spread over three years (2018-2020).These results, combined with other ancillary data, such as high-resolutionimages of the lens systems, and time delays, are necessary to increase thesample size of the quasar-galaxy lens systems for which the Hubble constant canbe measured, using the time-delay strong lensing method, hence increasing theprecision of its inference. Typically, the 2D spectra of the quasar-galaxy lenssystems get spatially blended due to seeing by ground-based observations. As aresult, the extracted lensing galaxy (deflector) spectra become significantlycontaminated by quasar light, which affects the ability to extract meaningfulinformation about the deflector. To account for spatial blending and extractless contaminated and higher signal-to-noise ratio (S/N) 1D spectra of thedeflectors, a forward modeling method has been implemented. From the extractedspectra, we have measured redshifts using prominent absorption lines and singleaperture velocity dispersions using the penalized pixel fitting code pPXF. Inthis paper, we report the redshifts and single aperture velocity dispersions ofeight lens galaxies - J0147+4630, B0445+123, B0631+519, J0659+1629, J0818-2613,J0924+0219, J1433+6007, and J1817+2729. Among these systems, six do not havepreviously measured velocity dispersions; for the other two, our measurementsare consistent with previously reported values. Additionally, we have measuredthe previously unknown redshifts of the deflectors in J0818-2613 and J1817+2729to be $0.866 \pm 0.002$ and $0.408 \pm 0.002$, respectively.",5
24,High-redshift JWST Observations and Primordial Non-Gaussianity,"['M. Biagetti', 'G. Franciolini', 'A. Riotto']","10 pages, 4 figures. v2: matching published version",Cosmology and Nongalactic Astrophysics (astro-ph.CO); General Relativity and Quantum Cosmology (gr-qc),Several bright and massive galaxy candidates at high redshifts have beenrecently observed by the James Webb Space Telescope. Such early massivegalaxies seem difficult to reconcile with standard $\Lambda$ Cold Dark Mattermodel predictions. We discuss under which circumstances such observed massivegalaxy candidates can be explained by introducing primordial non-Gaussianity inthe initial conditions of the cosmological perturbations.,3
25,Inflationary and phase-transitional primordial magnetic fields in galaxy clusters,"['Salome Mtchedlidze', 'Paola Domínguez-Fernández', 'Xiaolong Du', 'Wolfram Schmidt', 'Axel Brandenburg', 'Jens Niemeyer', 'Tina Kahniashvili']","21 pages, 13 figures, comments welcome",Cosmology and Nongalactic Astrophysics (astro-ph.CO); Astrophysics of Galaxies (astro-ph.GA),"Primordial magnetic fields (PMFs) are possible candidates for explaining theobserved magnetic fields in galaxy clusters. Two competing scenarios ofprimordial magnetogenesis have been discussed in the literature: inflationaryand phase-transitional. We study the amplification of both large- andsmall-scale correlated magnetic fields, corresponding to inflation- and phasetransition-generated PMFs, in a massive galaxy cluster. We employhigh-resolution magnetohydrodynamic cosmological zoom-in simulations to resolvethe turbulent motions in the intracluster medium. We find that the turbulentamplification is more efficient for the large-scale inflationary models, whilethe phase transition-generated seed fields show moderate growth. Thedifferences between the models are imprinted on the spectral characteristics ofthe field (such as the amplitude and the shape of the magnetic power spectrum)and therefore on the final correlation length. We find a one order of magnitudedifference between the final strengths of the inflation- and phasetransition-generated magnetic fields, and a factor of 1.5 difference betweentheir final coherence scales. Thus, the final configuration of the magneticfield retains information about the PMF generation scenarios. Our findings haveimplications for future extragalactic Faraday rotation surveys with thepossibility of distinguishing between different magnetogenesis scenarios.",7
26,Current data are consistent with flat spatial hypersurfaces in the $Λ$CDM cosmological model but favor more lensing than the model predicts,"['Javier de Cruz Perez', 'Chan-Gyung Park', 'Bharat Ratra']","83 pages, 39 figures. PRD accepted version, minor changes only",Cosmology and Nongalactic Astrophysics (astro-ph.CO); General Relativity and Quantum Cosmology (gr-qc),"We study the performance of three pairs of tilted $\Lambda$CDM cosmologicalmodels, two pairs allowing for non-flat spatial hypersurfaces with CMBtemperature and polarization power spectrum data (P18) from Planck, P18 lensing(lensing), and non-CMB data (non-CMB). For the six models, we measurecosmological parameters and study whether or not pairs of the data sets aremutually consistent in these models. Half of these models allow the lensingconsistency parameter $A_L$ to be an additional free parameter, while the otherthree have $A_L = 1$. The tilted spatially-flat models assume the usualprimordial spatial inhomogeneity power spectrum. The tilted non-flat modelsassume either the primordial power spectrum used in the Planck group analyses[Planck $P(q)$] or a recently computed power spectrum [new $P(q)$]. In thetilted non-flat models with $A_L=1$ we find differences between P18 data andnon-CMB data cosmological parameter constraints, which are large enough to ruleout the Planck $P(q)$ model at 3$\sigma$ but not the new $P(q)$ model. Whileboth P18 data and non-CMB data separately favor a closed geometry whenP18+non-CMB data are jointly analyzed the evidence in favor of non-flathypersurfaces subsides. Differences between P18 data and non-CMB datacosmological constraints subside when $A_L$ is allowed to vary. From the mostrestrictive P18+lensing+non-CMB data combination we get almostmodel-independent constraints and find that the $A_L>1$ option is preferredover the $\Omega_k<0$ one, with the $A_L$ parameter, for all models, beinglarger than unity by $\sim 2.5\sigma$. According to the deviance informationcriterion, in the P18+lensing+non-CMB analysis, the varying $A_L$ option is onthe verge of being strongly favored over the $A_L=1$ one, which could indicatea problem for the standard tilted flat $\Lambda$CDM model (Abridged abstract).",3
27,On Measuring the 21 cm Global Spectrum of the Cosmic Dawn with an Interferometer Array,"['Xin Zhang', 'Bin Yue', 'Yuan Shi', 'Fengquan Wu', 'Xuelei Chen']","18 pages, 23 figures, accepted for publication in ApJ",Cosmology and Nongalactic Astrophysics (astro-ph.CO),"We theoretically investigate the recovery of global spectrum (monopole) fromvisibilities (cross-correlation only) measured by the interferometer array andthe feasibility of extracting 21 cm signal of cosmic dawn. In our approach, theglobal spectrum is obtained by solving the monopole and higher-order componentssimultaneously from the visibilities measured with up to thousands ofbaselines. Using this algorithm, the monopole of both foreground and the 21 cmsignal can be correctly recovered in a broad range of conditions. We find thata 3D baseline distribution can have much better performance than a 2D (planar)baseline distribution, particularly when there is a lack of shorter baselines.We simulate for ground-based 2D and 3D array configurations, and a cross-shapedspace array located at the Sun-Earth L2 point that can form 3D baselinesthrough orbital precession. In all simulations we obtain good recovered globalspectrum, and successfully extract the 21 cm signal from it, with reasonablenumber of antennas and observation time.",5
